{
  "schema_version": "2.0.0",
  "id": "GRAPH-1",
  "revision": "r1",
  "trace": [
    {
      "from": {
        "id": "REQ-1",
        "revision": "r1",
        "location": "ledger.json"
      },
      "to": {
        "id": "PLAN-1",
        "revision": "r1",
        "location": "plan.json"
      },
      "relation": "SATISFIES",
      "evidence_ids": [
        "E-SOURCE"
      ],
      "state": "CURRENT",
      "reason": "Synthetic arithmetic fixture mapping"
    },
    {
      "from": {
        "id": "REQ-1",
        "revision": "r1",
        "location": "ledger.json"
      },
      "to": {
        "id": "DESIGN-1",
        "revision": "r1",
        "location": "design.json"
      },
      "relation": "SATISFIES",
      "evidence_ids": [
        "E-SOURCE"
      ],
      "state": "CURRENT",
      "reason": "Synthetic arithmetic fixture mapping"
    },
    {
      "from": {
        "id": "REQ-1",
        "revision": "r1",
        "location": "ledger.json"
      },
      "to": {
        "id": "BUILD-1",
        "revision": "r1",
        "location": "build.json"
      },
      "relation": "SATISFIES",
      "evidence_ids": [
        "E-SOURCE"
      ],
      "state": "CURRENT",
      "reason": "Synthetic arithmetic fixture mapping"
    },
    {
      "from": {
        "id": "REQ-1",
        "revision": "r1",
        "location": "ledger.json"
      },
      "to": {
        "id": "TEST-1",
        "revision": "r1",
        "location": "test.json"
      },
      "relation": "SATISFIES",
      "evidence_ids": [
        "E-SOURCE"
      ],
      "state": "CURRENT",
      "reason": "Synthetic arithmetic fixture mapping"
    },
    {
      "from": {
        "id": "REQ-1",
        "revision": "r1",
        "location": "ledger.json"
      },
      "to": {
        "id": "DEPLOY-1",
        "revision": "r1",
        "location": "deploy.json"
      },
      "relation": "SATISFIES",
      "evidence_ids": [
        "E-SOURCE"
      ],
      "state": "CURRENT",
      "reason": "Synthetic arithmetic fixture mapping"
    },
    {
      "from": {
        "id": "REQ-1",
        "revision": "r1",
        "location": "ledger.json"
      },
      "to": {
        "id": "MAINTAIN-1",
        "revision": "r1",
        "location": "maintain.json"
      },
      "relation": "SATISFIES",
      "evidence_ids": [
        "E-SOURCE"
      ],
      "state": "CURRENT",
      "reason": "Synthetic arithmetic fixture mapping"
    }
  ]
}
